OmniClass_Code,OmniClass_Title,Description
23-25 59 13-60,Surgical Pneumatic Saws,Pneumatic saws used in surgical procedures
23-25 59 13-61,Surgical Pneumatic Drills,Pneumatic drills used in surgical procedures
23-25 69 13-52,Laboratory Heating Drying Equipment,Equipment used to heat and dry materials in a laboratory setting
23-25 69 13-53,Laboratory Dry Baths,Laboratory equipment used to maintain a constant temperature
23-25 69 13-54,Bunsen Burner,A laboratory burner used to heat and ignite substances
23-25 69 13-55,Laboratory Hotplates,Laboratory equipment used to heat and maintain a constant temperature
23-25 69 13-56,Laboratory Incinerators,Equipment used to incinerate materials in a laboratory
23-25 69 13-57,Laboratory Infrared Dryers,Laboratory equipment used to dry materials using infrared heat
23-25 69 13-58,Laboratory Spirit Burners,Laboratory equipment used to heat materials using a flame
23-25 69 13-59,Laboratory Temperature Cycling Chambers,Laboratory equipment used to cycle temperatures for testing
23-25 69 13-110,Incubators,Enclosed chambers used to incubate and grow biological samples
23-25 69 13-111,CO2 Incubators,Incubators that maintain a controlled carbon dioxide environment
23-25 69 13-112,Cooled Biological Oxygen Demand BOD Incubators,Incubators that maintain a controlled temperature and oxygen level
23-25 69 13-113,Dry Wall Dual Chamber Carbon Dioxide Incubators,Incubators with separate chambers for carbon dioxide control
23-25 69 13-114,Dry Wall Dual Chamber Carbon Dioxide Incubators With Humidity Control,Incubators with separate chambers for carbon dioxide and humidity control
23-25 69 13-115,Dry Wall Dual Chamber Three Gas Incubators,Incubators with separate chambers for three gas control
23-25 69 13-116,Dry Wall Dual Chamber Three Gas Incubators With Humidity Control,Incubators with separate chambers for three gas and humidity control
23-25 69 13-117,Dry Wall Single Chamber Carbon Dioxide Incubators,Incubators with a single chamber for carbon dioxide control
23-25 69 13-118,Dry Wall Single Chamber Carbon Dioxide Incubators With Humidity Control,Incubators with a single chamber for carbon dioxide and humidity control
23-25 69 13-119,Dry Wall Single Chamber Three Gas Incubators,Incubators with a single chamber for three gas control
23-25 69 13-120,Dry Wall Single Chamber Three Gas Incubators With Humidity Control,Incubators with a single chamber for three gas and humidity control
23-25 69 13-121,Forced Air General Purpose Incubators,General purpose incubators that use forced air circulation
23-25 69 13-122,Gravity Convection General Purpose Incubators,General purpose incubators that use gravity convection
23-25 69 13-123,Mechanical Convection General Purpose Incubators,General purpose incubators that use mechanical convection
23-25 69 13-124,Multipurpose Incubators,Incubators that can be used for multiple purposes
23-25 69 13-125,Plate Incubators,Incubators designed for use with culture plates
23-25 69 13-126,Refrigerated Incubators,Incubators that maintain a controlled low temperature
23-25 69 13-127,Shaking Incubators,Incubators that agitate samples during incubation
23-25 69 13-128,Water Jacketed Dual Chamber Carbon Dioxide Incubators,Incubators with separate water-jacketed chambers for carbon dioxide control
23-25 69 13-129,Water Jacketed Dual Chamber Carbon Dioxide Incubators With Humidity Control,Incubators with separate water-jacketed chambers for carbon dioxide and humidity control
23-25 69 13-130,Water Jacketed Dual Chamber Three Gas Incubators,Incubators with separate water-jacketed chambers for three gas control
23-25 69 13-131,Water Jacketed Dual Chamber Three Gas Incubators With Humidity Control,Incubators with separate water-jacketed chambers for three gas and humidity control
23-25 69 13-132,Water Jacketed Single Chamber Carbon Dioxide Incubators,Incubators with a single water-jacketed chamber for carbon dioxide control
23-25 69 13-133,Water Jacketed Single Chamber Carbon Dioxide Incubators With Humidity Control,Incubators with a single water-jacketed chamber for carbon dioxide and humidity control
23-25 69 13-134,Water Jacketed Single Chamber Three Gas Incubators,Incubators with a single water-jacketed chamber for three gas control
23-25 69 13-135,Water Jacketed Single Chamber Three Gas Incubators With Humidity Control,Incubators with a single water-jacketed chamber for three gas and humidity control
23-25 69 13-136,Laboratory Ovens,Ovens used in laboratories for heating and drying materials
23-25 69 13-137,Laboratory Ageing Ovens,Ovens used in laboratories for ageing or heat-treating materials
23-25 69 13-138,Laboratory Cleanroom Ovens,Ovens designed for use in cleanroom environments
23-25 69 13-139,Laboratory Drying Cabinets,Cabinets used in laboratories for drying materials
23-25 69 13-140,Laboratory Drying Ovens,Ovens used in laboratories for drying materials
23-25 69 13-141,Laboratory Gravity Convection Ovens,Laboratory ovens that use gravity and natural convection to circulate air and heat samples.
23-25 69 13-142,Laboratory Induction Dryers,Laboratory dryers that use induction heating to dry samples.
23-25 69 13-143,Laboratory Mechanical Convection Ovens,Laboratory ovens that use mechanical fans to circulate air and heat samples.
23-25 69 13-144,Laboratory Vacuum Ovens,Laboratory ovens that use vacuum pressure to heat and dry samples.
23-25 69 13-145,Laboratory Distillers,Laboratory equipment used to distill liquids.
23-25 69 13-146,Laboratory Water Distillers,Laboratory equipment used to distill and purify water.
23-27 00 00,General Facility Services Products,General products and equipment used to provide facility services.
23-27 11 00,General Instruments and Controls,General instruments and controls for facility systems.
23-27 11 11,Temperature Measuring Instrument And Controls,Instruments and controls for measuring and regulating temperature.
23-27 11 11-1,Temperature Alarm Modules,Modules that monitor and alarm for temperature changes.
23-27 11 11-2,Temperature Control Modules,Modules that control temperature by adjusting heating or cooling.
23-27 11 11-3,Temperature Controllers,Devices that regulate temperature to a set point.
23-27 11 11-4,Digital Temperature Controllers,Digital controllers that regulate temperature electronically.
23-27 11 11-5,Electric Temperature Controllers,Electric controllers that regulate temperature using electricity.
23-27 11 11-6,Pneumatic Hating Controllers,Pneumatic controllers that regulate temperature using compressed air.
23-27 11 11-7,Hydraulic Temperature Controllers,Hydraulic controllers that regulate temperature using fluid pressure.
23-27 11 11-8,Temperature Detectors,Devices that detect and measure temperature.
23-27 11 11-9,Thermocouple Detectors,Temperature sensors that use thermocouple technology.
23-27 11 11-10,RTD Detectors,Temperature sensors that use resistance temperature detector (RTD) technology.
23-27 19 11,Reciprocating Engines,Engines that use a reciprocating motion to convert energy into mechanical power.
23-27 19 13,Rotary Engines,Engines that use a rotary motion to convert energy into mechanical power.
23-27 19 15,Turbine Engines,Engines that use turbine blades to convert energy into mechanical power.
23-27 21 00,Compressors,Machines that compress gases or vapors to increase their pressure.
23-27 21 11,Axial Flow Compressors,Compressors that use an axial flow design.
23-27 21 13,Centrifugal Compressors,Compressors that use a centrifugal design.
23-27 21 15,Reciprocating Compressors,Compressors that use a reciprocating piston design.
23-27 21 15-1,Diaphragm Reciprocating Compressors,Reciprocating compressors that use a diaphragm mechanism.
23-27 21 15-2,Double Acting Reciprocating Compressors,Reciprocating compressors that use a double-acting piston design.
23-27 21 15-3,Single Acting Reciprocating Compressors,Reciprocating compressors that use a single-acting piston design.
23-27 21 17,Rotary Compressors,Compressors that use a rotary motion to compress gases.
23-27 21 17-1,Rotary Liquid Ring Compressors,Rotary compressors that use a liquid ring design.
23-27 21 17-2,Rotary Lobe Compressors,Rotary compressors that use a lobe design.
23-27 21 17-3,Rotary Screw Compressors,Rotary compressors that use a screw design.
23-27 21 17-4,Rotary Scroll Compressors,Rotary compressors that use a scroll design.
23-27 21 17-5,Rotary Vane Compressors,Rotary compressors that use a vane design.
23-27 23 00,Heat Exchangers,Devices that transfer heat between two fluids or materials.
23-27 23 11,Heat Exchanger Economizers,Heat exchangers that use an economizer to improve efficiency.
23-27 23 13,Plate and Frame Heat Exchangers,Heat exchangers that use plates and frames to transfer heat.
23-27 23 13-1,Plate and Frame Regenerative Heat Exchangers,Plate and frame heat exchangers that use a regenerative design.
23-27 23 15,Shell and Tube Heat Exchangers,Heat exchangers that use a shell and tube design.
23-27 23 15-1,Shell and Tube Regenerative Heat Exchangers,Shell and tube heat exchangers that use a regenerative design.
23-27 23 17,Tube and Fin Heat Exchangers,Heat exchangers that use tubes and fins to transfer heat.
23-27 23 19,Spiral Heat Exchangers,Heat exchangers that use a spiral design.
23-27 23 19-1,Heat Exchangers for Ventilation Air,Heat exchangers designed for ventilation air systems.
23-27 23 21,Adiabatic Wheel Heat Exchangers,Heat exchangers that use an adiabatic wheel to transfer heat.
23-27 23 23,Plate and Fin Heat Exchangers,Heat exchangers that use plates and fins to transfer heat.
23-27 23 23-1,Straight Fin Plate and Fin Heat Exchangers,Plate and fin heat exchangers with straight fin design.
23-27 23 23-2,Offset Fin Plate and Fin Heat Exchangers,Plate and fin heat exchangers with offset fin design.
23-27 23 23-3,Wavy Fin Plate and Fin Heat Exchangers,Plate and fin heat exchangers with wavy fin design.
23-27 23 25,Fluid Heat Exchangers,Heat exchangers that transfer heat between fluids.
23-27 25 00,Heaters for Supplied Liquids,"Devices that heat liquids, such as water or oil, for use in building systems."
23-27 25 11,Liquid Electric Heaters,Heaters that use electricity to heat liquids.
23-27 25 13,Liquid Gas Heaters,Heaters that use gas to heat liquids.
23-27 25 15,Liquid Steam Heaters,Heaters that use steam to heat liquids.
23-27 25 17,Liquid Fuel Oil Heaters,Heaters that use fuel oil to heat liquids.
23-27 25 17-1,Fuel Oil Pre Heaters,Heaters that pre-heat fuel oil before use.
23-27 27 00,Pressure Reducing Stations,Stations that reduce the pressure of gases or liquids in building systems.
23-27 27 11,Multiple Stage Pressure Reducing Stations,Pressure reducing stations with multiple stages of pressure reduction.
23-27 27 13,Single Stage Pressure Reducing Stations,Pressure reducing stations with a single stage of pressure reduction.
23-27 29 00,Tanks and Storage Structures,Structures used to store liquids and gases in building systems.
23-27 29 11,Reservoirs,Large storage tanks or reservoirs for liquids and gases.
23-27 29 13,Tank Foundations,Foundations that support storage tanks.
23-27 29 13-1,Tank Support Structures,Structures that support and elevate storage tanks.
23-27 29 13-2,Tank Foundation Slabs,Concrete slabs that serve as the foundation for storage tanks.
23-27 29 15,Specialized Tanks,Specialized tanks for specific applications in building systems.
23-27 29 15-1,Cryogenic Tanks,Tanks designed to store cryogenic liquids like liquid nitrogen.
23-27 29 15-2,Flash Tanks,Tanks used to separate liquids and gases in building systems.
23-27 29 15-3,Steam Flash Tanks,Tanks used to separate steam and water in building systems.
23-27 29 15-4,Septic Tanks,Underground tanks used to collect and store wastewater.
23-27 29 15-5,Siphon Tanks,Tanks that use a siphon mechanism to discharge liquids.
23-29 13 11-5,Vein Recognition Readers,Devices that use vein patterns to identify and authenticate users.
23-29 25 00,Fire Fighting Equipment,Equipment used for firefighting and fire suppression in buildings.
23-29 25 11,Fire Fighting Terminals,Terminals or connection points for firefighting equipment.
23-29 25 11-1,Fire Fighting Terminal Components,Components that make up firefighting terminals.
23-29 29 15,Fire Switches,Switches that activate fire alarm and suppression systems.
23-29 29 15-1,Pressure Fire Alarm Water Flow Switches,Switches that detect water flow in fire sprinkler systems.
23-31 19 19-3,Sanitary Macerators,Devices that grind and macerate solid waste in plumbing systems.
23-33 13 00,Furnaces,Heating appliances that generate hot air or combustion gases.
23-33 13 11,Furnace Controls,Controls and components that regulate the operation of furnaces.
23-33 15 21-2,Finned Tube Radiators,Radiators with fins to increase heat transfer surface area.
23-33 15 21-3,Plate Radiators,Flat panel radiators that heat a space by radiation.
23-33 15 21-4,Radiation Heating Panels,Panels that heat a space primarily by radiant heat transfer.
23-33 15 23,Forced Air Hydronic HVAC Heaters,Forced air heaters that use hydronic heating systems.
23-33 15 23-1,Forced Air Cast Iron Radiators,Forced air radiators made of cast iron.
23-33 15 23-2,Forced Air Finned Tube Radiators,Forced air radiators with fins to increase heat transfer.
23-33 15 23-3,Forced Air Plate Radiators,Flat panel forced air radiators.
23-33 15 23-4,Forced Air Radiation Heating Panels,Forced air radiant heating panels.
23-33 15 25,Electric HVAC Heaters,Electric heaters used in HVAC systems.
23-33 15 25-1,Halogen Electric HVAC Heaters,Electric HVAC heaters that use halogen lamps.
23-33 15 25-2,Infrared Plate HVAC Heaters,Electric HVAC heaters that use infrared radiation.
23-33 15 25-3,Ultraviolet HVAC Heaters,Electric HVAC heaters that use ultraviolet radiation.
23-33 15 25-4,Electric HVAC Resitive Unit Heaters,Electric HVAC heaters that use resistance heating elements.
23-33 15 27,Forced Air Electric HVAC Heaters,Forced air electric heaters used in HVAC systems.
23-33 15 27-1,Forced Air Halogen Electric HVAC Heaters,Forced air HVAC heaters that use halogen lamps.
23-33 15 27-2,Forced Air Infrared Plate HVAC Heaters,Forced air HVAC heaters that use infrared radiation.
23-33 15 27-3,Forced Air Ultraviolet HVAC Heaters,Forced air HVAC heaters that use ultraviolet radiation.
23-33 15 27-4,Forced Air Electric HVAC Resitive Unit Heaters,Forced air HVAC heaters that use resistance heating elements.
23-33 15 29,HVAC Steam Hot Water Converters,Devices that convert steam or hot water to heat HVAC systems.
23-33 17 00,Heat Pumps,Devices that use a refrigeration cycle to both heat and cool buildings.
23-33 17 11,Packaged Heat Pumps,Self-contained heat pump units that provide both heating and cooling.
23-33 17 11-1,Air Source Packaged Heat Pumps,nan
23-33 17 11-2,Water Source Packaged Heat Pumps,nan
23-33 17 13,Split System Heat Pumps,nan
23-33 17 13-1,Air Source Split System Heat Pumps,nan
23-33 17 13-2,Water Source Split System Heat Pumps,nan
23-33 19 00,Cooling and Freeze Components,nan
23-33 19 11,Cooling Freeze Plant Accessories,nan
23-33 19 11-1,Refrigerant Liquid,nan
23-33 21 00,Chillers,nan
23-33 21 11,Absorption Chillers,nan
23-33 21 11-1,Direct Fired Absorption Chillers,nan
23-33 21 11-2,Steam Absorption Chillers,nan
23-33 21 13,Chillers,nan
23-33 21 13-1,Central Package Unit Chillers,nan
23-33 21 13-2,Centrifugal Chillers,nan
23-33 21 13-3,Packaged Centrifugal Chillers,nan
23-33 21 13-4,Split System Centrifugal Chillers,nan
23-33 21 13-5,Reciprocating Chillers,nan
23-33 21 13-6,Packaged Reciprocating Chillers,nan
23-33 21 13-7,Split System Reciprocating Chillers,nan
23-33 21 13-8,Rotary Chillers,nan
23-33 21 13-9,Packaged Rotary Chillers,nan
23-33 21 13-10,Split System Rotary Chillers,nan
23-33 21 13-11,Rotary Screw Chillers,nan
23-33 21 13-12,Packaged Rotary Screw Chillers,nan
23-33 21 13-13,Split System Rotary Screw Chillers,nan
23-33 21 13-14,Screw Chillers,nan
23-33 21 13-15,Packaged Screw Chillers,nan
23-33 21 13-16,Split System Screw Chillers,nan
23-33 29 23-2,Automatic Fire Dampers,nan
23-35 25 11,Electrical Meters,nan
23-35 29 25,Network Protectors,nan
23-35 37 49,Push Button Switches,nan
23-35 47 11-20,Explosion Proof Lighting Fixtures,nan
23-37 25 23-1,Television Broadcasting Equipment,nan
23-39 13 11-1,Tunnel Shafts,nan
23-39 15 21-3,Railway Baggage Cars,nan
23-39 15 21-4,Railway Diner Cars,nan
23-39 15 21-5,Railway Freight Cars,nan
23-39 21 11-21,Jetties,nan
23-39 21 13,Waterflow Controls,nan
23-39 21 13-1,Reservoirs,nan
23-39 21 13-2,"Dams, Dikes",nan
23-39 21 13-3,Weirs,nan
23-39 21 13-4,Barrages,nan
23-39 21 13-5,Bifurcation Panels,nan
23-39 21 13-6,Manifolds,nan
23-39 21 13-7,Penstocks and Sluice Gate,nan
23-39 21 13-8,Trash Rakes,nan
23-39 21 15,Breakwater Products,nan
23-39 21 15-1,Bulkheads,nan
23-39 21 15-2,Seawalls,nan
23-39 21 15-3,Moles and Breakwater,nan
23-39 21 15-4,Groins,nan
23-39 21 17,Marine Monitoring and Control,nan
23-39 21 17-1,Navigation Signs,nan
23-39 21 17-2,Navigation Lights,nan
23-39 21 17-3,Navigation Monitoring Equipment,nan
23-39 23 00,Electrical Utility Equipment,nan
23-39 23 11,Electrical Transmission Equipment,nan
23-39 23 11-1,Electrical Utility Poles,nan
23-39 23 11-2,Electrical Utility Towers,nan
23-39 25 00,Natural Gas Utility Equipment,nan
23-39 25 11,Natural Gas Utility Pipeline Equipment,nan
23-39 27 00,Water Utility Equipment,nan
23-39 27 11,Water Utility Pipeline Equipment,nan
23-39 29 00,Waste Water Collection and Removal,nan
23-39 29 11,Waste Water Drains,nan
23-39 29 11-1,Waste Water French Drains,nan
23-39 29 11-2,Waste Water Storm Drain,nan
23-39 29 11-3,Manhole (Goes in Prefab Concrete),nan
23-39 29 11-4,Manhole Cover,nan
23-39 29 11-5,Manhole Ladder,nan
23-39 29 11-6,Manhole Rung,nan
23-39 29 11-7,"Waste Water Drainage Pipes, Couplings, Collectors",nan
23-39 29 11-8,Wastewater Pipework Access Fittings,nan
23-39 29 13,Waste Water Subdrainage,nan
23-39 29 13-1,Geocomposite Drains,nan
23-39 29 13-2,Geotextile Subsurface Drainage Filtration,nan
23-39 29 13-3,Pipe Underdrain and Pavement Base Drain,nan
23-39 29 13-4,Subgrade Drains,nan
23-39 29 13-5,Surface Water Drainage Systems,nan
23-39 29 13-6,"Surface Water Catch Basins, Grates, and Frames",nan
23-39 29 13-7,Combination Storm Drain and Underdrain Inlets,nan
23-39 29 13-8,"Storm Drainage Manholes, Frames, and Covers",nan
23-39 29 13-9,Surface Water Retention Chambers,nan
23-39 29 13-10,Storm Water Ponds and Reservoirs,nan
23-39 29 13-11,Surface Water Retention Basins,nan
23-39 29 13-12,Storm Water Pond Covers,nan
23-39 29 13-13,Storm Water Pond Liners,nan
23-39 29 15,"Waste Water Channels, Gullies, Gratings, Covers",nan
23-39 31 00,Packaged Waste Water Treatment,nan
23-39 33 17-8,Floating Scum Skimming and Removal Equipment,nan
23-39 35 00,Water and Wastewater Chemical Feed Equipment,nan
23-39 35 11,Gas Chemical Feed Equipment,nan
23-39 35 11-1,Chlorine Gas Feed Equipment,nan
23-39 35 11-2,Sulfur Dioxide Gas Feed Equipment,nan
23-39 35 11-3,Ammonia Gas Feed Equipment,nan
23-39 35 11-4,"Gas Storage, Weighing, and Leak Detection Equipment",nan
23-39 35 11-5,Chlorine Dioxide Reactors,nan
23-39 35 11-6,Carbon Dioxide Gas Feed Equipment,Equipment that feeds and distributes carbon dioxide gas
23-39 35 11-7,Ozone Generating and Feed Equipment,Equipment that generates and feeds ozone gas
23-39 35 11-8,Liquid Oxygen Storage and Feed Equipment,Equipment that stores and feeds liquid oxygen
23-39 35 11-9,Cleaning Requirements for Oxygen Service,Requirements for cleaning equipment used with oxygen
23-39 35 11-10,Gas Chemical Feed Accessories and Safety Equipment,Accessories and safety equipment for gas chemical feed systems
23-39 35 13,Liquid Chemical Feed Equipment,Equipment that feeds and distributes liquid chemicals
23-39 35 13-1,Sodium Hypochlorite Generating Equipment,Equipment that generates sodium hypochlorite
23-39 35 13-2,Liquid Chemical Weighing Equipment,Equipment that weighs liquid chemicals
23-39 35 13-3,Polymer Blending and Feed Equipment,Equipment that blends and feeds polymer chemicals
23-39 35 13-4,Diaphragm-type Metering Pumps,Diaphragm-type pumps for metering liquid chemicals
23-39 35 13-5,Peristaltic Metering Pumps,Peristaltic pumps for metering liquid chemicals
23-39 35 13-6,Progressing Cavity Metering Pumps,Progressing cavity pumps for metering liquid chemicals
23-39 35 13-7,Lobe Metering Pumps,Lobe pumps for metering liquid chemicals
23-39 35 13-8,Drum Pumps,Pumps for transferring liquid chemicals from drums
23-39 35 13-9,Liquid Chemical Transfer Pumps,Pumps for transferring liquid chemicals
23-39 35 13-10,Liquid Chemical Diffusers,Equipment that diffuses liquid chemicals into water
23-39 35 13-11,Liquid Chemical Feed Accessories and Safety Equipment,Accessories and safety equipment for liquid chemical feed systems
23-39 35 15,Dry Chemical Feed Equipment,Equipment that feeds and distributes dry chemicals
23-39 35 15-1,Storage Silos,Silos for storing dry chemicals
23-39 35 15-2,Dry Chemical Weighing Equipment,Equipment that weighs dry chemicals
23-39 35 15-3,Volumetric Feed Equipment,Equipment that volumetrically feeds dry chemicals
23-39 35 15-4,Gravimetric Feed Equipment,Equipment that gravimetrically feeds dry chemicals
23-39 35 15-5,Lime Slaking Equipment,Equipment that slakes lime
23-39 35 15-6,Chemical Tablet Feeding Equipment,Equipment that feeds chemical tablets
23-39 35 15-7,Dry Chemical Feed Accessories and Safety Equipment,Accessories and safety equipment for dry chemical feed systems
23-39 37 00,Water and Wastewater Clarification and Mixing Equipment,Equipment that clarifies and mixes water and wastewater
23-39 37 11,Mixing Equipment,Equipment that mixes water and wastewater
23-39 37 11-1,Rapid Mixers,Rapid mixers that quickly mix water and chemicals
23-39 37 11-2,Inline Blender-type Rapid Mixers,Inline blender-type rapid mixers
23-39 37 11-3,Induction-type Rapid Mixing Equipment,Induction-type rapid mixing equipment
23-39 37 11-4,Inline Static Mixers,Inline static mixers that mix water and chemicals
23-39 37 11-5,Mixing Equipment,General mixing equipment
23-39 37 11-6,Submersible Mixers,Submersible mixers that mix water and wastewater
23-39 37 11-7,Floating Mechanical Mixers,Floating mechanical mixers that mix water and wastewater
23-39 37 11-8,Paddle Mixers,Paddle mixers that mix water and wastewater
23-39 37 11-9,Pin Mixers,Pin mixers that mix water and wastewater
23-39 37 11-10,Vertical Reel Flocculation Equipment,Vertical reel flocculation equipment
23-39 37 11-11,Horizontal Reel Flocculation Equipment,Horizontal reel flocculation equipment
23-39 37 11-12,Vertical Turbine Flocculation Equipment,Vertical turbine flocculation equipment
23-39 37 11-13,Walking-beam Flocculation Equipment,Walking-beam flocculation equipment
23-39 37 11-14,Horizontal Oscillating Flocculation Equipment,Horizontal oscillating flocculation equipment
23-39 37 11-15,Top-entering Tank Mixers,Top-entering tank mixers that mix water and wastewater
23-39 37 11-16,Side-entry Tank Mixers,Side-entry tank mixers that mix water and wastewater
23-39 37 11-17,Portable Tank Mixers,Portable tank mixers that mix water and wastewater
23-39 37 13,Clarifier Equipment,Equipment that clarifies water and wastewater
23-39 37 13-1,Chain-and-Flight Clarifier Equipment,Chain-and-flight clarifier equipment
23-39 37 13-2,Traveling Bridge Clarifier Equipment,Traveling bridge clarifier equipment
23-39 37 13-3,Differential Head Clarifier Equipment,Differential head clarifier equipment
23-39 37 13-4,Oscillating Scraper-type Clarifier Equipment,Oscillating scraper-type clarifier equipment
23-39 37 13-5,Circular Clarifier Equipment,Circular clarifier equipment
23-39 37 13-6,Solids Contact Clarifier Equipment,Equipment used to clarify water or wastewater by removing solids through contact and settling.
23-39 37 13-7,"Flocculating Clarifier, Pulsating Sludge Blanket Type",Equipment that uses a pulsating sludge blanket to clarify water or wastewater.
23-39 37 13-8,Dissolved Air Flotation Equipment for Water Treatment,Equipment that uses dissolved air flotation to remove solids from water or wastewater.
23-39 37 13-9,Ballasted High-rate Clarifier Equipment,High-rate clarifier equipment that uses ballasted flocculation to remove solids.
23-39 37 13-10,High rate Clarification/Thickening Equipment,Equipment that combines high-rate clarification and thickening to remove solids from water or wastewater.
23-39 37 13-11,Tube Settlers,Equipment that uses tube-shaped settlers to remove solids from water or wastewater.
23-39 37 13-12,Lined Plate Settlers,Equipment that uses lined plate settlers to remove solids from water or wastewater.
23-39 37 15,Sediment Removal Equipment,Equipment used to remove sediment from water or wastewater systems.
23-39 37 15-1,Tipping Sediment Flushing Tanks,Tanks that can be tipped to flush out accumulated sediment.
23-39 37 15-2,Flushing Gates,Gates that can be opened to flush out accumulated sediment.
23-39 37 15-3,Water Cannon,Equipment that uses a water cannon to flush out accumulated sediment.
23-39 39 00,Water and Wastewater Secondary Treatment Equipment,Equipment used for the secondary treatment of water or wastewater.
23-39 39 11,Air and Gas Diffusion Equipment,Equipment used to diffuse air or gas into water or wastewater for treatment.
23-39 39 11-1,Fixed Mechanical Aerators,Aerators that are fixed in place to mix and aerate water or wastewater.
23-39 39 11-2,Floating Mechanical Aerators,Aerators that float on the surface to mix and aerate water or wastewater.
23-39 39 11-3,Submersible Aspirating Aerator Equipment,Submersible aerators that use aspiration to mix and aerate water or wastewater.
23-39 39 11-4,Jet Aeration Equipment,Jet aeration equipment that uses high-velocity jets to mix and aerate water or wastewater.
23-39 39 11-5,Coarse Bubble Diffusers,Diffusers that release large bubbles to aerate water or wastewater.
23-39 39 11-6,Swing-type Channel Aeration Equipment,Aeration equipment that swings back and forth to mix and aerate water or wastewater.
