OmniClass_Code,OmniClass_Title,Description
22-07 95 63,Bridge Expansion Joint Cover Assemblies,Expansion joint cover assemblies for bridges.
22-08 00 00,Openings,"Openings in buildings, such as doors, windows, and hatches."
22-08 36 19,Multi-Leaf Vertical Lift Doors,Multi-leaf vertical lift doors that open upwards.
22-08 62 00,Unit Skylights,"Skylights that are self-contained units, not part of a larger framed system."
22-08 62 13,Domed Unit Skylights,Domed-shaped unit skylights.
22-08 62 16,Pyramidal Unit Skylights,Pyramidal-shaped unit skylights.
22-08 62 19,Vaulted Unit Skylights,Vaulted-shaped unit skylights.
22-08 62 23,Tubular Skylights,Tubular skylights that bring natural light into a space.
22-08 63 00,Metal-Framed Skylights,Skylights with metal framing systems.
22-08 63 13,Domed Metal-Framed Skylights,Domed-shaped metal-framed skylights.
22-08 63 16,Pyramidal Metal-Framed Skylights,Pyramidal-shaped metal-framed skylights.
22-08 63 19,Vaulted Metal-Framed Skylights,Vaulted-shaped metal-framed skylights.
22-08 63 23,Ridge Metal-Framed Skylights,Ridge-style metal-framed skylights.
22-08 63 53,Motorized Metal-Framed Skylights,Motorized metal-framed skylights.
22-08 64 00,Plastic-Framed Skylights,Skylights with plastic framing systems.
22-08 65 00,Glazed Canopies,Glazed canopies that provide overhead coverage.
22-08 65 13,Suspended Glazed Canopies,Suspended glazed canopies.
22-08 67 00,Skylight Protection and Screens,Screens and protection systems for skylights.
22-08 70 00,Hardware,"Hardware for doors, windows, and other building components."
22-08 71 00,Door Hardware,"Hardware for doors, including power operators."
22-08 71 13,Power Door Operators,"Security hardware for doors, such as locks and access controls."
22-08 71 53,Security Door Hardware,Access control hardware that is not integrated with a building system.
22-08 74 00,Non-Integrated Access Control Hardware,Card key access control hardware that is not integrated.
22-08 74 13,Non-Integrated Card Key Access Control Hardware,Keypad access control hardware that is not integrated.
22-08 74 16,Non-Integrated Keypad Access Control Hardware,Biometric access control hardware that is not integrated.
22-08 74 19,Non-Integrated Biometric Identity Access Control Hardware,"Hardware for windows, including automatic and manual operators."
22-08 75 00,Window Hardware,Automatic equipment for operating windows.
22-08 75 13,Automatic Window Equipment,Manual operators for opening and closing windows.
22-08 75 16,Window Operators,Specialized hardware for unique building functions.
22-08 78 00,Special Function Hardware,"Accessories for hardware, such as key storage."
22-08 79 00,Hardware Accessories,"Glass used for glazing in windows, doors, and other applications."
22-08 79 13,Key Storage Equipment,Decorative glass used for glazing.
22-08 80 00,Glazing,Glass glazing used on the exterior of buildings.
22-08 81 00,Glass Glazing,Glass glazing used on the interior of buildings.
22-08 81 13,Decorative Glass Glazing,Mirrors used as glazing.
22-08 81 23,Exterior Glass Glazing,Mirrored glass glazing.
22-08 81 26,Interior Glass Glazing,Mirrored plastic glazing.
22-08 83 00,Mirrors,"Plastic used for glazing in windows, doors, and other applications."
22-08 83 13,Mirrored Glass Glazing,Decorative plastic glazing.
22-08 83 16,Mirrored Plastic Glazing,"Accessories for glazing, such as sealants and gaskets."
22-08 84 00,Plastic Glazing,Films applied to glazing for specialized functions.
22-08 84 13,Decorative Plastic Glazing,Films applied to glazing for solar control.
22-08 85 00,Glazing Accessories,Films applied to glazing for safety and security.
22-08 87 00,Glazing Surface Films,Safety films applied to glazing.
22-08 87 13,Solar Control Films,Security films applied to glazing.
22-08 87 23,Safety and Security Films,Films applied to glazing to deter bird strikes.
22-08 87 23-1,Safety Films,Decorative films applied to glazing.
22-08 87 23-2,Security Films,"Glazing with specialized functions, such as fire-resistance or hurricane-resistance."
22-08 87 26,Bird Control Film,nan
22-08 87 33,Decorative Films,nan
22-08 88 00,Special Function Glazing,nan
22-08 88 13,Fire-Rated Glazing,nan
22-08 88 19,Hurricane-Resistant Glazing,nan
22-08 88 23,Cable Suspended Glazing,nan
22-09 22 36,Lath,nan
22-09 22 36-1,Gypsum Lath,nan
22-09 22 36-2,Metal Lath,nan
22-09 22 39,Veneer Plaster Base,nan
22-09 62 53,Synthetic Turf Flooring,nan
22-09 62 63,Metal Flooring,nan
22-09 62 63-1,Aluminum Flooring,nan
22-09 62 63-2,Stainless Steel Flooring,nan
22-09 62 83,Structural Glass Flooring,nan
22-09 63 00,Masonry Flooring,nan
22-09 63 13,Brick Flooring,nan
22-09 63 13-1,Chemical-Resistant Brick Flooring,nan
22-09 63 40,Stone Flooring,nan
22-09 63 43,Composition Stone Flooring,nan
22-09 64 00,Wood Flooring,nan
22-09 64 16,Wood Block Flooring,nan
22-09 64 19,Wood Composition Flooring,nan
22-09 64 23,Wood Parquet Flooring,nan
22-09 64 23-1,Acrylic-Impregnated Wood Parquet Flooring,nan
22-09 64 29,Wood Strip and Plank Flooring,nan
22-09 64 33,Laminated Wood Flooring,nan
22-09 64 36,Bamboo Flooring,nan
22-09 64 53,Resilient Wood Flooring Assemblies,nan
22-09 64 66,Wood Athletic Flooring,nan
22-09 65 00,Resilient Flooring,nan
22-09 65 13,Resilient Base and Accessories,nan
22-09 65 13-1,Resilient Base,nan
22-09 65 13-2,Resilient Stair Treads and Risers,nan
22-09 65 13-3,Resilient Stair Nosings,nan
22-09 65 13-4,Resilient Accessories,nan
22-09 69 19,Stringerless Access Flooring,nan
22-10 41 00,Emergency Access and Information Cabinets,nan
22-10 41 13,Fire Department Plan Cabinets,nan
22-10 41 16,Emergency Key Cabinets,nan
22-10 56 19-1,Recycled Plastic Storage Shelving,nan
22-10 73 16-1,Metal Canopies,nan
22-10 73 16-2,Fabric Canopies,nan
22-10 73 16-3,Glazed Canopies,nan
22-10 73 16-4,Point Supported Glass Canopies,nan
22-11 01 50,Operation and Maintenance of Educational and Scientific Equipment,nan
22-11 01 56,Operation and Maintenance of Observatory Equipment,nan
22-11 13 19-2,Stationary Loading Dock Lifts,nan
22-11 13 19-3,Loading Dock Truck Lifts,nan
22-11 22 13-1,Safe Deposit Boxes,nan
22-11 22 13-2,Safes,nan
22-11 22 13-3,Vault Ventilators,nan
22-11 22 13-4,Time Capsules,nan
22-11 22 16,Teller and Service Equipment,nan
22-11 22 16-1,Teller Equipment Systems,nan
22-11 22 16-2,Automatic Banking Systems,"Automated systems for banking and financial transactions, such as ATMs and kiosks."
22-11 61 33-3,Curtain Systems,"Systems for hanging and operating curtains, including tracks, rods, and controls."
22-11 61 43,Stage Curtains,Curtains used on stages and in theaters for performance spaces.
22-11 98 14,Detention Door Hardware,"Hardware for doors in detention facilities, such as locks, hinges, and security features."
22-12 20 00,Window Treatments,"Products for covering and controlling light through windows, including blinds, shades, and curtains."
22-12 21 00,Window Blinds,Window coverings that use horizontal slats to control light and privacy.
22-12 21 13,Horizontal Louver Blinds,Window blinds with horizontal slats made of metal.
22-12 21 13-1,Metal Horizontal Louver Blinds,Window blinds with horizontal slats made of wood.
22-12 21 13-2,Wood Horizontal Louver Blinds,Window blinds with horizontal slats made of plastic.
22-12 21 13-3,Plastic Horizontal Louver Blinds,Window coverings that use vertical slats to control light and privacy.
22-12 21 16,Vertical Louver Blinds,Window blinds with vertical slats made of metal.
22-12 21 16-1,Metal Vertical Louver Blinds,Window blinds with vertical slats made of wood.
22-12 21 16-2,Wood Vertical Louver Blinds,Window blinds with vertical slats made of plastic.
22-12 21 16-3,Plastic Vertical Louver Blinds,Window coverings that roll up and down to control light and privacy.
22-12 21 23,Roll-Down Blinds,Window coverings that block out all light for darkening a room.
22-12 21 26,Black-Out Blinds,"Fabric window coverings that hang from a track or rod, including curtains and drapes."
22-12 22 00,Curtains and Drapes,Decorative fabric window coverings that hang from a track or rod.
22-12 22 13,Draperies,Hardware and accessories for hanging and operating draperies.
22-12 22 16,Drapery Track and Accessories,"Window coverings installed inside a window frame, made of wood or other materials."
22-12 23 00,Interior Shutters,Window coverings made of wood that are installed inside a window frame.
22-12 23 13,Wood Interior Shutters,Window coverings that roll up and down to control light and privacy.
22-12 24 00,Window Shades,Window shades that roll up and down on a roller mechanism.
22-12 24 13,Roller Window Shades,Window shades with pleated fabric that fold up and down.
22-12 24 16,Pleated Window Shades,Window shades with Z-shaped pleated fabric that fold up and down.
22-12 24 16-1,Z-Pleated Window Shades,Window shades with cellular or honeycomb-shaped fabric that fold up and down.
22-12 24 16-2,Cellular Shades,Window shades with fabric that folds up and down in a Roman-style.
22-12 24 16-3,Roman Shades,"Hardware and controls for operating window treatments, such as motors and switches."
22-12 25 00,Window Treatment Operating Hardware,Automated control systems for operating window treatments.
22-12 25 09,Window Treatment Control System,Motorized rods for opening and closing draperies.
22-12 25 13,Motorized Drapery Rods,"Devices installed in windows to control natural daylight, such as louvers and light shelves."
22-12 26 00,Interior Daylighting Devices,"Cabinets, shelves, and other built-in furniture for storage and organization."
22-12 30 00,Casework,"Cabinets and casework made of metal, often with a sandwich panel construction."
22-12 31 00,Manufactured Metal Casework,Cabinets and casework made of wood veneer over a substrate.
22-12 31 16,Manufactured Metal Sandwich Panel Casework,Cabinets and casework with a plastic laminate finish over a wood or wood-like substrate.
22-12 32 00,Manufactured Wood Casework,Cabinets and casework made entirely of plastic materials.
22-12 32 13,Manufactured Wood-Veneer-Faced Casework,Cabinets and casework made of solid plastic materials.
22-12 32 16,Manufactured Plastic-Laminate-Clad Casework,Cabinets and casework made of solid surface materials like quartz or acrylic.
22-12 34 00,Manufactured Plastic Casework,"Specialized cabinets and casework for specific applications, such as banks, hotels, and homes."
22-12 34 16,Manufactured Solid-Plastic Casework,Cabinets and casework designed for use in bank and financial institution settings.
22-12 34 19,Manufactured Solid Surface Casework,"Cabinets and casework designed for use in hotels, resorts, and other hospitality settings."
22-12 35 00,Specialty Casework,"Cabinets and casework designed for use in residential settings, such as kitchens and bathrooms."
22-12 35 17,Bank Casework,Cabinets and casework designed specifically for use in kitchens.
22-12 35 25,Hospitality Casework,Cabinets and casework designed specifically for use in bathrooms.
22-12 35 30,Residential Casework,Cabinets and casework designed specifically for use in dormitories and student housing.
22-12 35 30-1,Kitchen Casework,Cabinets and casework designed for use in utility rooms and laundry areas.
22-12 35 30-2,Bathroom Casework,Cabinets and casework designed for use in mailrooms and postal facilities.
22-12 35 30-3,Dormitory Casework,Cabinets and casework designed specifically for use in commercial kitchens.
22-12 35 33,Utility Room Casework,nan
22-12 35 36,Mailroom Casework,nan
22-12 35 39,Commercial Kitchen Casework,nan
22-12 35 50,Educational/Library Casework,Casework and built-in furnishings for educational and library spaces.
22-12 35 50-1,Educational Casework,Casework and built-in furnishings specifically designed for educational spaces.
22-12 35 50-2,Library Casework,Casework and built-in furnishings specifically designed for library spaces.
22-12 35 50-3,Built-In Study Carrels,Built-in study carrels and workstations for educational facilities.
22-12 45 13,Bed Linens,"Bedding items such as blankets, comforters, and other linens."
22-12 45 13-1,Blankets,Blankets used for warmth and comfort on beds.
22-12 45 13-2,Comforters,Quilted or filled bed coverings used for warmth and comfort.
22-12 45 16,Pillows,Pillows used for support and comfort when sleeping.
22-12 46 00,Furnishing Accessories,Miscellaneous furnishing accessories for residential and commercial spaces.
22-12 46 13,Ash Receptacles,"Receptacles for collecting and disposing of ashes, typically found in smoking areas."
22-12 46 16,Bowls,Decorative bowls used for display or serving purposes.
22-12 46 19,Clocks,Clocks used for timekeeping in residential and commercial spaces.
22-12 46 23,Decorative Crafts,Decorative crafts and artwork used for aesthetic purposes.
22-12 46 26,Decorative Screens,Decorative screens used to divide or conceal spaces.
22-12 46 29,Vases,Vases used for displaying flowers or other decorative items.
22-12 46 33,Waste Receptacles,Receptacles used for collecting and disposing of waste materials.
22-12 48 00,Rugs and Mats,Floor coverings such as rugs and mats for residential and commercial spaces.
22-12 48 13,Entrance Floor Mats and Frames,Mats and frames used at building entrances to collect dirt and debris.
22-12 48 13-1,Entrance Floor Mats,Mats used at building entrances to collect dirt and debris.
22-12 48 13-2,Entrance Floor Mat Frames,Frames used to hold entrance floor mats in place.
22-12 48 16,Entrance Floor Grilles,Grilles used at building entrances to collect dirt and debris.
22-12 48 19,Entrance Floor Gratings,Gratings used at building entrances to collect dirt and debris.
22-12 48 23,Entrance Floor Grids,Grids used at building entrances to collect dirt and debris.
22-12 48 26,Entrance Tile,Tile used at building entrances to collect dirt and debris.
22-12 48 43,Floor Mats,Mats used in various locations to provide comfort and safety.
22-12 48 43-1,Chair Mats,Mats used under office chairs to protect flooring.
22-12 48 43-2,Anti-Fatigue Floor Mats,Mats used in areas where people stand for long periods to reduce fatigue.
22-12 48 43-3,Fall-Cushioning Floor Mats,Mats used in areas where people may fall to cushion the impact.
22-12 48 53,Rugs,Rugs used for decorative and functional purposes in residential and commercial spaces.
22-12 48 53-1,Runners,"Long, narrow rugs used in hallways and entryways."
22-12 48 53-2,Oriental Rugs,"Rugs with intricate, traditional designs often found in Middle Eastern and Asian cultures."
22-12 50 00,Furniture,"Furniture used in residential, commercial, and institutional settings."
22-12 51 00,Office Furniture,Furniture used in office and administrative settings.
22-12 51 16,Case Goods,"Furniture such as desks, cabinets, and bookcases used in office settings."
22-12 51 16-1,Metal Case Goods,Metal case goods used in office settings.
22-12 51 16-2,Wood Case Goods,Wooden case goods used in office settings.
22-12 51 16-3,Plastic-Laminate-Clad Case Goods,Case goods with plastic laminate surfaces used in office settings.
22-12 51 19,Filing Cabinets,Cabinets used for storing and organizing files and documents.
22-12 51 19-1,Lateral Filing Cabinets,Filing cabinets that store documents horizontally.
22-12 51 19-2,Vertical Filing Cabinets,Filing cabinets that store documents vertically.
22-12 51 23,Office Tables,Tables used in office and administrative settings.
22-12 51 83,Custom Office Furniture,Custom-designed furniture for office and administrative settings.
22-12 52 00,Seating,"Seating furniture used in residential, commercial, and institutional settings."
22-12 52 13,Chairs,"Chairs used in a variety of settings, including offices, homes, and public spaces."
22-12 52 19,Upholstered Seating,Upholstered seating furniture used in a variety of settings.
22-12 52 23,Office Seating,Chairs and other seating specifically designed for office and administrative settings.
22-12 52 70,Healthcare Seating,Seating furniture designed for use in healthcare settings.
22-12 52 83,Custom Seating,"Custom-designed seating furniture for residential, commercial, and institutional settings."
22-12 53 00,Retail Furniture,Furniture used in retail and commercial settings.
22-12 53 83,Custom Retail Furniture,Custom-designed furniture for retail and commercial settings.
22-12 54 00,Hospitality Furniture,"Furniture designed for use in hotels, motels, restaurants, and other hospitality settings."
22-12 54 13,Hotel and Motel Furniture,"Furniture specifically designed for use in hotels and motels, such as beds, dressers, and nightstands."
22-12 54 16,Restaurant Furniture,"Furniture designed for use in restaurants, such as tables, chairs, and booths."
22-12 54 83,Custom Hospitality Furniture,"Custom-made furniture for hospitality settings like hotels, motels, and restaurants."
22-12 55 00,Detention Furniture,"Furniture designed for use in detention facilities, such as beds, desks, and chairs."
22-12 60 00,Multiple Seating,"Seating designed to accommodate multiple people, such as benches and pews."
22-13 01 50,Operation and Maintenance of Special Instrumentation,Maintenance and operation of specialized instrumentation used to monitor and measure various conditions.
22-13 01 51,Operation and Maintenance of Stress Instrumentation,Maintenance and operation of instrumentation used to measure stress and strain in structures.
22-13 34 13-3,Swimming Pool Enclosures,Enclosures designed to protect swimming pools from the elements.
22-13 34 13-4,Sunrooms,Enclosed structures that provide additional living space and access to the outdoors.
22-13 34 13-5,Conservatories,"Enclosed structures that provide additional living space and access to the outdoors, similar to a sunroom."
22-13 34 16,Grandstands and Bleachers,"Elevated seating structures used for spectator events, such as sports games and concerts."
22-13 34 16-1,Grandstands,"Elevated seating structures used for spectator events, such as sports games and concerts."
22-13 34 16-2,Bleachers,"Elevated seating structures used for spectator events, such as sports games and concerts."
22-13 34 18,Post Frame Building Systems,Building systems constructed using post-frame construction techniques.
22-13 34 19,Metal Building Systems,Building systems constructed using pre-engineered metal components.
22-13 34 23,Fabricated Structures,"Prefabricated structures designed for a variety of uses, such as portable buildings and control booths."
22-13 34 23-1,Portable and Mobile Buildings,Prefabricated portable or mobile buildings.
22-13 34 23-2,Fabricated Classroom Buildings,Prefabricated classroom buildings.
22-13 34 23-3,Fabricated Control Booths,Prefabricated control booths or enclosures.
22-13 34 23-4,Fabricated Dome Structures,Prefabricated dome-shaped structures.
22-13 34 23-5,Fabricated Substation Control Rooms,Prefabricated control rooms for electrical substations.
22-13 34 23-6,Fabricated Cold Storage Buildings,Prefabricated cold storage buildings.
22-13 34 56,Observatories,Structures designed for astronomical observation and research.
22-13 35 00,Rammed Earth Construction,Construction techniques that use compacted soil to create walls and other structural elements.
22-13 35 13,Rammed Earth Walls,Walls constructed using rammed earth techniques.
22-13 35 13-1,Traditional Rammed Earth Walls,Traditional rammed earth walls without additional stabilization.
22-13 35 13-2,Stabilized Insulated Rammed Earth Walls,Rammed earth walls with added stabilizers and insulation.
22-13 36 00,Towers,Freestanding structures designed to support equipment or provide observation platforms.
22-13 36 13,Metal Towers,"Towers constructed using metal, typically steel."
22-13 36 13-1,Steel Towers,Towers constructed using steel.
22-13 36 23,Wood Towers,Towers constructed using wood.
22-13 40 00,Integrated Construction,Construction techniques that integrate multiple building components and systems.
22-13 42 00,Building Modules and Components,"Prefabricated building modules and components, such as bathrooms, hotel rooms, and dormitories."
22-13 42 13,Bathroom Unit Modules,Prefabricated bathroom units designed for installation in buildings.
22-13 42 25,Hospitality Unit Modules,Prefabricated hotel or motel room units.
22-13 42 33,Apartment Unit Modules,Prefabricated apartment units.
22-13 42 43,Dormitory Unit Modules,Prefabricated dormitory units.
22-13 42 46,Education Unit Modules,Prefabricated units for educational facilities.
22-13 42 63,Detention Cell Modules,Prefabricated detention cells or housing units.
22-13 42 63-1,Precast-Concrete Detention Cell Modules,Precast concrete detention cell modules.
22-13 42 63-2,Steel Detention Cell Modules,Steel detention cell modules.
22-13 42 73,Integrated Interior Modules,"Prefabricated interior building components, such as floor, wall, and ceiling assemblies."
22-13 42 73-1,Integrated Floor Assemblies,Prefabricated floor assemblies designed for integrated installation.
22-13 42 73-2,Integrated Wall Assemblies,Prefabricated wall assemblies designed for integrated installation.
22-13 42 73-3,Integrated Ceiling Assemblies,Prefabricated ceiling assemblies designed for integrated installation.
22-13 44 00,Modular Mezzanines,Prefabricated mezzanine structures designed for installation in buildings.
22-13 46 00,Lightning Protection Systems,Systems designed to protect buildings and structures from lightning strikes.
22-13 46 13,Lightning Protection for Structures,Lightning protection systems installed on buildings and structures.
22-13 46 16,Lightning Prevention and Dissipation,Systems designed to prevent or dissipate lightning strikes.
22-13 46 19,Early Streamer Emission Lightning Protection,A lightning protection system that uses early streamer emission technology to provide faster and more effective lightning strike protection.
22-13 46 23,Lightning Monitoring Equipment,Equipment used to monitor and detect lightning activity in a facility's vicinity to help prevent damage from lightning strikes.
22-13 47 00,Facility Protection,"Systems and equipment used to protect a facility and its occupants from various hazards, including fire, security threats, and natural disasters."
22-13 47 13,Cathodic Protection,"A system that uses electrical current to prevent corrosion of metal structures, such as underground pipes and tanks, by creating a protective coating."
22-13 47 13-1,Cathodic Protection for Underground and Submerged Piping,Cathodic protection system specifically designed for underground and submerged metal piping to prevent corrosion.
22-13 47 13-2,Cathodic Protection for Underground Storage Tanks,Cathodic protection system designed for underground storage tanks to prevent corrosion and leaks.
22-13 47 13-3,Cathodic Protection for Concrete Reinforcing,Cathodic protection system used to protect concrete reinforcing steel from corrosion.
22-13 48 00,"Sound, Vibration, and Seismic Control","Systems and equipment used to control and mitigate the effects of sound, vibration, and seismic activity in a facility."
22-13 48 13,Manufactured Sound and Vibration Control Components,"Manufactured components, such as vibration isolators and sound-absorbing materials, used to control sound and vibration in a facility."
22-14 14 00,Hydraulic Dumbwaiters,A type of dumbwaiter that uses hydraulic power to move loads vertically within a building.
22-14 20 00,Elevators,Vertical transportation systems used to move people and goods between floors of a building.
22-14 21 00,Electric Traction Elevators,Elevators that use an electric traction system to move the cab vertically.
22-14 21 13,Electric Traction Freight Elevators,Electric traction elevators designed specifically for transporting freight and cargo.
22-14 21 23,Electric Traction Passenger Elevators,Electric traction elevators designed for transporting passengers.
22-14 21 23-1,Machine Room Electric Traction Passenger Elevators,Electric traction passenger elevators with a machine room located above the hoistway.
22-14 21 23-2,Machine Room-Less Electric Traction Passenger Elevators,"Electric traction passenger elevators without a separate machine room, with the drive system integrated into the hoistway."
22-14 21 33,Electric Traction Residential Elevators,Electric traction elevators designed for use in residential buildings.
22-14 21 43,Electric Traction Service Elevators,Electric traction elevators designed for transporting service personnel and materials.
22-14 24 00,Hydraulic Elevators,Elevators that use a hydraulic system to move the cab vertically.
22-14 24 13,Hydraulic Freight Elevators,Hydraulic elevators designed specifically for transporting freight and cargo.
22-14 24 23,Hydraulic Passenger Elevators,Hydraulic elevators designed for transporting passengers.
22-14 24 33,Hydraulic Residential Elevators,Hydraulic elevators designed for use in residential buildings.
22-14 24 43,Hydraulic Service Elevators,Hydraulic elevators designed for transporting service personnel and materials.
22-14 25 00,Rack and Pinion Elevators,Elevators that use a rack and pinion system to move the cab vertically.
22-14 26 00,Limited-Use/Limited-Application Elevators,"Elevators with limited capacity and travel distance, often used in small buildings or as accessibility solutions."
22-14 27 00,Custom Elevator Cabs and Doors,Custom-designed elevator cabs and doors to meet specific aesthetic or functional requirements.
22-14 27 13,Custom Elevator Cab Finishes,Custom finishes and materials used to create unique elevator cab interiors.
22-14 27 16,Custom Elevator Doors,Custom-designed elevator doors to meet specific aesthetic or functional requirements.
22-14 28 00,Elevator Equipment and Controls,"Equipment and controls used to operate and maintain elevators, including safety systems."
22-14 28 16,Elevator Controls,The control systems that manage the operation and movement of elevators.
22-14 28 19,Elevator Equipment,Various equipment and components used in the construction and operation of elevators.
