OmniClass_Code,OmniClass_Title,Description
11-13 11 23,Public Health and Safety Facility,A facility that provides public health and safety services.
11-13 27 23,Miscellaneous Personnel Shelter,A shelter that provides temporary housing for various personnel.
11-13 27 26,Public Restroom/Shower,A public restroom and shower facility.
11-13 29 00,Juvenile Facility,A facility that houses and cares for juvenile offenders or at-risk youth.
11-13 29 11,Orphanage,A residential facility that provides care and housing for orphaned children.
11-13 29 14,Foster Home,A residential facility that provides temporary care and housing for foster children.
11-14 00 00,Cultural Facility,A facility that houses cultural and artistic activities and exhibits.
11-14 15 00,Monument and Memorial,"A structure or site that commemorates a significant person, event, or achievement."
11-14 21 00,Museum,"A facility that houses collections and exhibits related to art, history, science, or other topics."
11-14 21 11,Art Museum,A museum that focuses on the display and interpretation of art and artistic works.
11-14 21 14,History Museum,A museum that focuses on the display and interpretation of historical artifacts and information.
11-14 21 17,Science and Technology Museum,A museum that focuses on the display and interpretation of scientific and technological advancements.
11-14 21 21,Children’s Museum,A museum that is designed specifically for children and their educational and recreational needs.
11-14 21 24,Special Purpose Museum,"A museum that focuses on a specific topic or theme, such as a particular culture, industry, or subject matter."
11-14 24 00,Religious Institution,"A facility that houses religious activities, worship, and education."
11-14 24 11,Religious Facility,"A building or structure used for religious worship, ceremonies, and activities."
11-14 24 15,Religious Education Facility,A facility that provides educational and training programs related to a particular religion or faith.
11-14 24 18,Religious Monument or Icon,A structure or site that is significant or sacred to a particular religion or faith.
11-14 24 21,Religious Pilgrimage Site,A site that is visited by religious pilgrims or devotees for spiritual or religious purposes.
11-14 24 24,Religious Retreat,A facility that provides temporary lodging and retreat for religious or spiritual purposes.
11-15 00 00,Recreation Facility,A facility that provides recreational activities and amenities for the public.
11-15 11 00,Outdoor Recreation Facility,An outdoor facility that provides opportunities for recreational activities in a natural setting.
11-15 11 11,Nature Preserve,A protected area of land or water that is set aside for the preservation of natural habitats and wildlife.
11-15 11 14,Hunting Preserve,A designated area for hunting and wildlife management.
11-15 11 21,Fishing Preserve,A designated area for fishing and aquatic recreation.
11-15 11 27,Target Range,A facility that provides a safe and controlled environment for target shooting and firearms training.
11-15 11 34,Outdoor Winter Sports Facility,An outdoor facility that provides opportunities for winter sports and activities.
11-15 11 34-1,Ski Slope,A facility that provides a designated slope or area for downhill skiing and snowboarding.
11-15 11 34-2,Outdoor Skating Rink,An outdoor facility that provides a designated area for ice skating and other winter sports.
11-15 11 34-3,Snowmobile Course,A designated area or course for snowmobile riding and recreation.
11-15 11 36,Golf Facility,A facility that provides opportunities for golf-related activities and amenities.
11-15 11 36-1,Golf Driving Range,A facility that provides a designated area for practicing and improving golf skills.
11-15 11 36-2,Golf Course,A facility that provides a designated golf course for playing the game of golf.
11-15 11 36-3,Miniature Golf Course,A facility that provides a miniature golf course for recreational and entertainment purposes.
11-15 11 36-4,Golf Pitch and Putt Course,A facility that provides a shorter golf course for practicing and recreational play.
11-15 11 39,Playground,A designated outdoor area that provides play equipment and activities for children.
11-15 11 41,Outdoor Racquet Sports Facility,An outdoor facility that provides courts and amenities for racquet sports.
11-15 11 41-1,Outdoor Tennis Facility,An outdoor facility that provides tennis courts and amenities for playing tennis.
11-15 11 41-2,Outdoor Squash Facility,An outdoor facility that provides courts and amenities for playing squash.
11-15 11 41-3,Outdoor Racquetball Facility,An outdoor facility that provides courts and amenities for playing racquetball.
11-15 11 44,Outdoor Water Recreation Facility,An outdoor facility that provides opportunities for water-based recreational activities.
11-15 11 44-1,Outdoor Swimming Pool,An outdoor facility that provides a designated swimming pool for recreational use.
11-15 11 44-2,Outdoor Water Park,An outdoor facility that provides a designated water park with various water-based attractions.
11-15 11 47,Outdoor Team Sports Facility,An outdoor facility that provides designated fields and courts for team sports.
11-15 11 47-1,Outdoor Football Field,An outdoor facility that provides a designated field for playing American football.
11-15 11 47-2,Outdoor Soccer Field,An outdoor facility that provides a designated field for playing soccer.
11-15 11 47-3,Outdoor Baseball or Softball Diamond,An outdoor facility that provides a designated diamond for playing baseball or softball.
11-15 11 47-4,Outdoor Basketball Court,An outdoor facility that provides a designated court for playing basketball.
11-15 11 52,Outdoor Sports Training Facility,An outdoor facility that provides a designated area for sports training and practice.
11-15 11 55,Pavilion,An outdoor structure or pavilion that provides a covered and sheltered space for various activities.
11-15 11 58,Animal Recreation Facility,nan
11-15 11 58-1,Zoo/Nature Facility,nan
11-21 12 19,Critical Access Hospital,nan
11-21 12 23,Freestanding Urgent Care Facility,nan
11-21 12 27,Freestanding Cancer Treatment Facility,nan
11-21 12 31,Rehabilitation Hospital,nan
11-21 15 00,Outpatient Care Facility,nan
11-21 15 11,Primary Care Outpatient Care Facility,nan
11-21 15 15,Small Outpatient Care Facility,nan
11-21 15 19,Freestanding Outpatient Diagnostic and Treatment Facility,nan
11-21 15 23,Outpatient Surgery Facility,nan
11-21 15 27,Office Surgery Facility,nan
11-21 15 31,Gastrointestinal Endoscopy Facility,nan
11-21 15 35,Renal Dialysis Center,nan
11-21 15 39,Outpatient Rehabilitation Facility,nan
11-21 15 43,Freestanding Birth Center,nan
11-21 15 47,Adult Day Health Care Facility,nan
11-21 17 00,Medical Office Building (MOB),nan
11-21 22 00,Ambulatory Care Facility,nan
11-21 22 11,Ambulatory Surgery Center,nan
11-21 22 15,Comprehensive Ambulatory Care Center,nan
11-21 25 00,Residential Health Care Facility,nan
11-21 25 11,Residential Nursing Facility,nan
11-21 25 15,Residential Hospice Facility,nan
11-21 25 19,Assisted Living Facility,nan
11-21 28 00,"Mobile, Transportable, Relocatable Health Care Unit",nan
11-21 32 00,"Mental, Behavioral Care Facility",nan
11-21 32 11,Psychiatric Hospital,nan
11-21 32 15,Psychiatric Outpatient Facility,nan
11-21 35 00,Maternity Facility,nan
11-21 38 00,Animal Healthcare Facility,nan
11-21 42 00,Dental Facility,nan
11-21 45 00,Medical Center,nan
11-21 48 00,Medical Warehouse,nan
11-21 52 00,Ambulance Shelter,nan
11-21 55 00,Death Facility,nan
11-21 55 11,Funeral Home,nan
11-21 55 15,Cremation Facility,nan
11-21 55 19,Cemetery,nan
11-21 55 23,Columbarium,nan
11-23 00 00,Hospitality Facility,nan
11-23 12 00,Dining Establishment,nan
11-23 12 11,Military Dining Facility,nan
11-23 12 15,Military Dining Support Facility,nan
11-23 12 19,Military Open Mess and Club Facility,nan
11-23 12 23,Military Exchange Eating Facility,nan
11-23 12 27,Military Non-Exchange Eating Facility,nan
11-23 12 31,Fast Food Restaurant,nan
11-23 12 35,Full Service Restaurant,nan
11-23 12 43,Limited Service Restaurant,nan
11-23 12 47,Student Dining Hall,A dining hall for students to eat meals.
11-23 15 00,"Tavern, Bar, or Micro-Brewery","A tavern, bar, or micro-brewery where alcoholic beverages are served."
11-23 18 00,Nightclub,A nightclub or dance club where people go to socialize and dance.
11-27 55 11,Operations Support Lab,A lab that supports operations and maintenance activities.
11-51 31 11,Auto Maintenance and Fueling Station,A facility for maintaining and fueling vehicles.
12-21 17 25,Reservoir,A reservoir or storage tank for water.
13-31 17 00,Training Spaces,Spaces used for training and education purposes.
13-31 17 11,Computer Lab,A computer lab for hands-on technology training.
13-31 17 13,Woodshop/Metalshop,A workshop for woodworking or metalworking.
13-31 17 15,Training Support Space,Spaces that support training activities.
13-31 17 17,Religious Education Space,Spaces for religious education and activities.
13-31 19 00,Study Spaces,Spaces for individual or group study.
13-31 19 13,Study Room,A private room for individual or small group study.
13-31 19 15,Study Service,Spaces that support study activities.
13-33 00 00,Recreation Spaces,Spaces for recreational activities.
13-33 11 00,Athletic Recreation Spaces,Spaces for athletic and sports-related recreation.
13-33 11 11,Athletic  Spectator Seating,Seating for spectators at athletic events.
13-33 11 11-1,Bleacher,Bleachers or temporary seating for spectators.
13-33 11 13,Team Athletic Recreation Spaces,Spaces for team sports and athletic activities.
13-33 11 13-1,Baseball Field,A baseball field for playing the sport.
13-33 11 13-2,Softball Fields,Softball fields for playing the sport.
13-33 11 13-3,Dugouts,Dugouts for players during baseball or softball games.
13-33 11 13-4,Grass Playing Fields,Grass playing fields for various sports.
13-33 11 13-5,Synthetic Fields,Synthetic turf playing fields for various sports.
13-33 11 13-6,Football Field,A football field for playing the sport.
13-33 11 13-7,Soccer Field,A soccer field for playing the sport.
13-33 11 13-8,Basketball Courts,Basketball courts for playing the sport.
13-33 11 13-9,Field Light Poles,Lighting poles for illuminating outdoor playing fields.
13-33 11 13-10,Press Box,A press box for media and officials at athletic events.
13-33 11 13-11,Scoreboards,Scoreboards for displaying scores and game information.
13-33 11 15,Individual Athletic Recreation Spaces,Spaces for individual sports and athletic activities.
13-33 11 15-1,Hard Playing Surfaces,Hard surfaces for various sports and activities.
13-33 11 15-2,Tennis Courts,Tennis courts for playing the sport.
13-33 11 15-3,Volleyball Court,A volleyball court for playing the sport.
13-33 11 15-4,Golf Course,A golf course for playing the sport.
13-33 11 15-5,Driving Range,A driving range for practicing golf shots.
13-33 11 15-6,Golf Course Support Space,Spaces that support a golf course.
13-33 11 15-7,Skating Rink,An ice skating rink for recreational skating.
13-33 11 15-8,Boxing Ring,A boxing ring for boxing matches and training.
13-33 11 15-9,Wrestling Mat,A wrestling mat for wrestling matches and training.
13-33 11 15-10,Diving Board,Diving boards for diving into a pool.
13-33 11 15-11,Bowling Lane,Bowling lanes for playing the sport.
13-33 11 15-12,Dart Throwing Area,An area for throwing darts.
13-33 11 15-13,Circuit Training Course Area,A circuit training course for cardiovascular exercise.
13-33 11 15-14,Running Tracks,Running tracks for running and jogging.
13-33 11 15-15,Ski Lift Space,Spaces for ski lifts and related equipment.
13-33 11 15-16,Exercise Space,Spaces for general exercise and fitness activities.
13-33 11 15-17,Workout Station,Individual workout stations for strength training.
13-33 11 15-18,Aerobic Studio,A studio for aerobic exercise classes.
13-33 11 15-19,Climbing Wall,A climbing wall for rock climbing and bouldering.
13-33 11 15-20,Ropes Course Elements,"Elements used in a ropes course, such as climbing walls, zip lines, and other recreational equipment."
13-33 13 00,Swimming Pools,An outdoor or indoor swimming pool for recreational or competitive use.
13-33 13 11,Outdoor Swimming Pool,An outdoor swimming pool for recreational or competitive use.
13-33 13 13,Indoor Swimming Pool,An indoor swimming pool for recreational or competitive use.
13-33 13 13-1,Diving Tank,A specialized swimming pool for diving activities.
13-33 15 00,Non-Athletic Recreation Spaces,"Spaces for non-athletic recreational activities, such as parks, playgrounds, and community centers."
13-33 15 11,Park,An outdoor public space with amenities for recreation and leisure.
13-37 11 15-2,Audience Seating Space,"A space for seating an audience, such as in a theater or auditorium."
13-51 14 29,"Nursery, Airborne Infection Isolation",A nursery room for infants and young children with specialized air filtration to prevent airborne infections.
13-51 14 31,"Nursery, Observation",A nursery room for observing and monitoring infants and young children.
13-51 61 73,Whirlpool,A therapeutic whirlpool or hot tub for rehabilitation and relaxation.
13-51 61 75,Rehabilitation Living Skills Training Apartment,A simulated apartment for training individuals in independent living skills.
13-51 64 00,Dental Spaces,"Spaces dedicated to dental care, including treatment rooms, laboratories, and support areas."
13-51 64 11,Dental CS Suite,"A suite of rooms for comprehensive dental care, including treatment, imaging, and sterilization."
13-51 64 13,Dental Hygiene and Operatory Room,A room for dental hygiene and dental procedures.
13-51 64 15,Dental Hygiene Room,A room dedicated to dental hygiene services.
13-51 64 17,Dental Porcelain Room,A room for fabricating dental prosthetics and porcelain work.
13-51 64 19,Dental Prosthetics Laboratory,A laboratory for creating dental prosthetics and appliances.
13-51 64 21,Dental Screening Room,A room for initial dental screening and evaluation.
13-51 64 23,Dental Self Preparation Area,A space for patients to prepare for dental procedures.
13-51 64 25,"Dental Treatment t Room, Mini Laboratory",A treatment room with a mini-laboratory for dental procedures.
13-51 64 27,Dental Treatment Room,A standard dental treatment room for general procedures.
13-51 64 29,"Dental Treatment Room, Conscious Sedation Support",A treatment room for dental procedures requiring conscious sedation.
13-51 64 31,"Dental Treatment Room, Endodontics",A treatment room for endodontic (root canal) procedures.
13-51 64 33,"Dental Treatment Room, Orthodontics",A treatment room for orthodontic procedures.
13-51 64 35,"Dental Treatment Room, Pediatrics",A treatment room for pediatric dental care.
13-51 64 37,"Dental Treatment Room, Periodontics",A treatment room for periodontal (gum) procedures.
13-51 64 39,"Dental Treatment Room, Prosthodontics",A treatment room for prosthodontic (denture) procedures.
13-51 64 41,Dental X-Ray Room,A room dedicated to dental X-ray imaging.
13-51 64 43,Instrument Preparation and Sterilization Room,A room for preparing and sterilizing dental instruments.
13-51 64 45,Maxillo-Facial Laboratory,A laboratory for maxillofacial (jaw and face) prosthetics.
13-51 64 47,Maxillo-Facial Treatment Room,A treatment room for maxillofacial procedures.
13-51 64 49,Oral Pathology Laboratory,A laboratory for oral pathology research and analysis.
13-51 64 51,Oral Surgery Residency Room,A room for oral surgery residency training.
13-51 64 53,Oral Surgery Room,A treatment room for oral surgery procedures.
13-51 64 55,Panoramic Dental X-Ray Room,A room for panoramic dental X-ray imaging.
13-51 64 57,Dental X-Ray Support Room,A support room for dental X-ray imaging.
13-51 67 00,Medical Research and Development Spaces,"Spaces for medical research and development, including laboratories and animal holding areas."
13-51 67 11,Research Animal Recovery Area,A recovery area for research animals.
13-51 67 13,"Barrier Suite, Procedure Laboratory",A laboratory for conducting procedures in a barrier-controlled environment.
13-51 67 15,Biomedical Research BSL3 Suite Tissue Culture Room,A tissue culture room for biomedical research at Biosafety Level 3.
13-51 67 17,Biomedical Research Tissue Culture Room,A general tissue culture room for biomedical research.
13-51 67 18,"Laboratory, Research, Biochemistry",A biochemistry research laboratory.
13-51 67 19,Biosafety Level 3 Laboratory,A Biosafety Level 3 laboratory for infectious disease research.
13-51 67 21,"BSL3 Infectious Disease Suite, Procedure Laboratory",A procedure laboratory for a Biosafety Level 3 infectious disease suite.
13-51 67 23,BSL3 Procedure Room,A procedure room for a Biosafety Level 3 infectious disease suite.
13-51 67 25,Environmental Suite Infectious Disease Procedure Laboratory,A procedure laboratory for an environmental infectious disease suite.
13-51 67 27,Research Infectious Disease Animal Holding Area,An animal holding area for infectious disease research.
13-51 67 29,Research Veterinary Radiography Control Room,A control room for veterinary radiography research.
13-51 67 31,Research and Development Machine Shop,nan
13-51 67 33,Research Veterinary Radiography Procedure Room,A room used for veterinary radiography procedures in a research facility.
13-51 67 35,Research Diagnostic Laboratory,A laboratory used for diagnostic research in a research facility.
13-51 67 37,Research NMR Room,A room used for nuclear magnetic resonance (NMR) research in a research facility.
13-51 67 39,Research Procedure Laboratory,A laboratory used for research procedures in a research facility.
13-51 67 41,"Research Veterinary Surgical Suite, Animal Preparation Room",A room used for animal preparation in a veterinary surgical suite in a research facility.
13-51 67 43,Research Veterinary BSL3 Infectious Disease Suite Holding Room,A holding room for a veterinary BSL3 infectious disease suite in a research facility.
13-51 67 45,Research Veterinary Barrier Suite Holding Room,A holding room for a veterinary barrier suite in a research facility.
13-51 67 47,Research Veterinary Chemical/Radioisotope Suite Holding Room,A holding room for a veterinary chemical/radioisotope suite in a research facility.
13-51 67 49,Research Veterinary Environmental Suite Holding Room,A holding room for a veterinary environmental suite in a research facility.
13-51 67 51,Research Veterinary Quarantine Holding Room,A holding room for a veterinary quarantine area in a research facility.
13-55 15 00,Trading Spaces,Spaces used for trading or exchanging goods or services.
13-57 13 15-8,Table Bussing Station,A station for bussing or clearing tables in a food service or dining area.
13-61 17 00,Spaces for Protection from Violence,Spaces designed to protect occupants from violence or other threats.
14-34 11 27,Summit,"A high point or peak, such as a mountain summit."
21-01 90 30-1,Anchor Tiebacks,Anchors or tiebacks used to stabilize or support a structure.
21-01 90 30-2,Cofferdams,A temporary barrier or enclosure used to keep water out of a construction site.
21-01 90 30-3,Cribbing and Walers,Wooden or metal supports used to brace or reinforce a structure.
21-01 90 30-4,Ground Freezing,The process of freezing soil to improve its stability or bearing capacity.
21-01 90 30-5,Slurry Walls,A wall or barrier made of a slurry mixture used to contain or control water.
21-01 90 40,Soil Treatment,The treatment or modification of soil to improve its properties.
21-02 00 00,Shell,The exterior shell or envelope of a building.
21-02 20 80-1,Exterior Fixed Grilles and Screens,Fixed exterior grilles or screens used for ventilation or security.
21-02 20 80-2,Exterior Opening Protection Devices,Exterior devices used to protect openings from weather or intruders.
21-02 20 80-3,Exterior Balcony Walls and Railings,Exterior walls and railings surrounding a balcony or deck.
21-03 10 30-6,Interior Panel Doors,Interior doors that are not standard panel doors.
21-03 10 30-7,Interior Special Function Doors,"Interior doors with specialized functions, such as fire-rated or security doors."
21-03 10 30-8,Interior Access Doors and Panels,Interior access doors or panels used for maintenance or inspection.
21-03 10 30-9,Interior Door Supplementary Components,"Supplementary components for interior doors, such as hardware or frames."
21-04 20 20,Sanitary Drainage,The system for collecting and disposing of sanitary waste from a building.
21-04 20 20-1,Sanitary Sewerage Equipment,"Equipment used in a sanitary sewerage system, such as pumps or valves."
21-04 20 20-2,Sanitary Sewerage Piping,Piping used to convey sanitary waste from a building.
21-04 40 10-1,Water-Based Fire-Suppression,Systems used to suppress or extinguish fires using water-based methods.
21-04 40 10-2,Fire-Extinguishing,Systems used to extinguish fires using non-water-based methods.
21-04 60 30-2,Electronic Digital Systems,Electronic digital systems used for building automation or control.
21-06 10 20-2,Space Frames,Structural framing systems that use a three-dimensional grid or lattice.
21-06 10 20-3,Geodesic Structures,Structures based on the principles of geodesic design.
21-06 10 20-4,Manufacturer-Engineered Structures,Structures that are engineered and manufactured off-site.
21-06 10 20-5,Manufactured Canopies,Prefabricated canopy structures installed on-site.
21-07 00 00,Sitework,The work performed on a construction site to prepare the land for building.
21-07 10 00,Site Preparation,"The initial steps in site preparation, such as clearing vegetation or debris."
21-07 10 10,Site Clearing,"The removal of vegetation, topsoil, or other materials from a construction site."
21-07 20 30-1,Pedestrian Pavement,"Paved surfaces for pedestrian traffic, such as sidewalks or plazas."
21-07 20 30-2,Pedestrian Pavement Curbs and Gutters,"Curbs, gutters, or other features associated with pedestrian pavement."
21-07 30 30-4,Site Storm Water Drains,Drainage systems used to manage stormwater runoff on a construction site.
22-00 31 25-3,Existing Metals Information,Information about existing metal components or systems in a building.
22-00 31 25-4,"Existing Wood, Plastics, and Composites Information","Information about existing wood, plastic, or composite materials in a building."
22-00 31 25-5,Existing Thermal and Moisture Protection Information,Information about existing thermal or moisture protection systems in a building.
22-00 31 26,Existing Hazardous Material Information,Information about hazardous materials present in an existing building.
22-00 31 26-1,Existing Asbestos Information,Information about the presence of asbestos in an existing building.
22-00 31 26-2,Existing Lead Information,Information about the presence of lead in an existing building.
22-00 31 26-3,Existing Polychlorinate Biphenyl Information,Information about existing polychlorinated biphenyls (PCBs) in a building or site.
22-00 31 26-4,Existing Mold Information,Information about existing mold in a building or site.
22-00 31 26-5,Existing Hazardous Waste Drum Information,Information about existing hazardous waste drums in a building or site.
22-00 31 31,Geophysical Data,"Data from geophysical investigations, such as surveys of the Earth's physical properties."
22-00 31 31-1,Seismic Investigations Information,"Information from seismic investigations, which use vibrations to study the subsurface."
22-00 31 31-2,Gravity Investigations Information,"Information from gravity investigations, which measure variations in the Earth's gravitational field."
22-00 31 31-3,Magnetic Investigations Information,"Information from magnetic investigations, which measure variations in the Earth's magnetic field."
22-00 31 31-4,Electromagnetic Investigations Information,"Information from electromagnetic investigations, which use electromagnetic fields to study the subsurface."
22-00 31 31-5,Electrical Resistivity Investigations Information,"Information from electrical resistivity investigations, which measure the resistance of the subsurface to electric current."
22-00 31 31-6,Magnetotelluric Investigations Information,"Information from magnetotelluric investigations, which use natural electromagnetic fields to study the subsurface."
22-00 31 32,Geotechnical Data,"Data from geotechnical investigations, such as soil and rock testing."
22-00 31 32-1,Subsurface Drilling and Sampling Information,"Information from subsurface drilling and sampling, used to characterize the soil and rock conditions."
22-00 31 32-2,Material Testing Information,"Information from material testing, such as laboratory analysis of soil and rock samples."
22-00 31 32-3,Exploratory Excavation Information,"Information from exploratory excavations, used to directly observe subsurface conditions."
22-00 31 32-4,Geotechnical Monitoring Information,"Information from geotechnical monitoring, such as measurements of soil and rock behavior over time."
22-00 31 43,Permit Application,Documents required to apply for permits related to a construction project.
22-00 31 46,Permits,"Permits required for a construction project, such as building, zoning, or environmental permits."
22-00 40 00,Procurement Forms and Supplements,Forms and supplemental documents used in the procurement process for a construction project.
22-00 41 00,Bid Forms,"Forms used to submit bids for a construction project, typically a single-prime or multiple-prime contract."
22-00 41 13,Bid Form - Stipulated Sum (Single-Prime Contract),Bid form for a stipulated sum (fixed price) single-prime contract.
22-00 41 16,Bid Form - Stipulated Sum (Multiple-Prime Contract),Bid form for a stipulated sum (fixed price) multiple-prime contract.
22-00 41 23,Bid Form - Construction Management (Single-Prime Contract),Bid form for a construction management single-prime contract.
22-00 41 26,Bid Form - Construction Management (Multiple-Prime Contract),Bid form for a construction management multiple-prime contract.
